No.;Time;Source;Destination;Protocol;Length;Info;
3;0.001932;192.168.1.100;192.168.1.103;Modbus/TCP;66;   Query: Trans:    56;" Unit:   1, Func:   3: Read Holding Registers"""
8;0.055901;192.168.1.100;192.168.1.103;TCP;54;51003  >  502 [ACK] Seq=13 Ack=18 Win=64583 Len=0;
12;0.111987;192.168.1.100;192.168.1.103;Modbus/TCP;66;   Query: Trans:    57;" Unit:   1, Func:   3: Read Holding Registers"""
19;0.180779;192.168.1.100;192.168.1.103;TCP;54;51003  >  502 [ACK] Seq=25 Ack=35 Win=64566 Len=0;
27;0.264822;192.168.1.100;192.168.1.103;Modbus/TCP;66;   Query: Trans:    58;" Unit:   1, Func:   3: Read Holding Registers"""
32;0.322966;192.168.1.100;192.168.1.103;TCP;54;51003  >  502 [ACK] Seq=37 Ack=52 Win=64549 Len=0;
36;0.374399;192.168.1.100;192.168.1.103;Modbus/TCP;66;   Query: Trans:    59;" Unit:   1, Func:   3: Read Holding Registers"""
43;0.446903;192.168.1.100;192.168.1.103;TCP;54;51003  >  502 [ACK] Seq=49 Ack=69 Win=64532 Len=0;
46;0.505762;192.168.1.100;192.168.1.103;Modbus/TCP;66;   Query: Trans:    60;" Unit:   1, Func:   3: Read Holding Registers"""
55;0.571037;192.168.1.100;192.168.1.103;TCP;54;51003  >  502 [ACK] Seq=61 Ack=86 Win=64515 Len=0;
58;0.631106;192.168.1.100;192.168.1.103;Modbus/TCP;66;   Query: Trans:    61;" Unit:   1, Func:   3: Read Holding Registers"""
67;0.708971;192.168.1.100;192.168.1.103;TCP;54;51003  >  502 [ACK] Seq=73 Ack=103 Win=64498 Len=0;
70;0.757349;192.168.1.100;192.168.1.103;Modbus/TCP;66;   Query: Trans:    62;" Unit:   1, Func:   3: Read Holding Registers"""
79;0.832851;192.168.1.100;192.168.1.103;TCP;54;51003  >  502 [ACK] Seq=85 Ack=120 Win=64481 Len=0;
82;0.885672;192.168.1.100;192.168.1.103;Modbus/TCP;66;   Query: Trans:    63;" Unit:   1, Func:   3: Read Holding Registers"""
91;0.957940;192.168.1.100;192.168.1.103;TCP;54;51003  >  502 [ACK] Seq=97 Ack=137 Win=64464 Len=0;
94;1.021.123;192.168.1.100;192.168.1.103;Modbus/TCP;66;   Query: Trans:    64;" Unit:   1, Func:   3: Read Holding Registers"""
103;1.082.754;192.168.1.100;192.168.1.103;TCP;54;51003  >  502 [ACK] Seq=109 Ack=154 Win=64447 Len=0;
106;1.147.122;192.168.1.100;192.168.1.103;Modbus/TCP;66;   Query: Trans:    65;" Unit:   1, Func:   3: Read Holding Registers"""
115;1.210.622;192.168.1.100;192.168.1.103;TCP;54;51003  >  502 [ACK] Seq=121 Ack=171 Win=64430 Len=0;
122;1.288.778;192.168.1.100;192.168.1.103;Modbus/TCP;66;   Query: Trans:    66;" Unit:   1, Func:   3: Read Holding Registers"""
127;1.352.056;192.168.1.100;192.168.1.103;TCP;54;51003  >  502 [ACK] Seq=133 Ack=188 Win=64413 Len=0;
130;1.401.390;192.168.1.100;192.168.1.103;Modbus/TCP;66;   Query: Trans:    67;" Unit:   1, Func:   3: Read Holding Registers"""
139;1.475.406;192.168.1.100;192.168.1.103;TCP;54;51003  >  502 [ACK] Seq=145 Ack=205 Win=64396 Len=0;
142;1.533.626;192.168.1.100;192.168.1.103;Modbus/TCP;66;   Query: Trans:    68;" Unit:   1, Func:   3: Read Holding Registers"""
151;1.599.503;192.168.1.100;192.168.1.103;TCP;54;51003  >  502 [ACK] Seq=157 Ack=222 Win=64379 Len=0;
154;1.659.211;192.168.1.100;192.168.1.103;Modbus/TCP;66;   Query: Trans:    69;" Unit:   1, Func:   3: Read Holding Registers"""
163;1.724.847;192.168.1.100;192.168.1.103;TCP;54;51003  >  502 [ACK] Seq=169 Ack=239 Win=64362 Len=0;
170;1.814.697;192.168.1.100;192.168.1.103;Modbus/TCP;66;   Query: Trans:    70;" Unit:   1, Func:   3: Read Holding Registers"""
175;1.898.884;192.168.1.100;192.168.1.103;TCP;54;51003  >  502 [ACK] Seq=181 Ack=256 Win=64345 Len=0;
182;1.965.006;192.168.1.100;192.168.1.103;Modbus/TCP;66;   Query: Trans:    71;" Unit:   1, Func:   3: Read Holding Registers"""
187;2.022.893;192.168.1.100;192.168.1.103;TCP;54;51003  >  502 [ACK] Seq=193 Ack=273 Win=64328 Len=0;
194;2.098.905;192.168.1.100;192.168.1.103;Modbus/TCP;66;   Query: Trans:    72;" Unit:   1, Func:   3: Read Holding Registers"""
201;2.164.352;192.168.1.100;192.168.1.103;TCP;54;51003  >  502 [ACK] Seq=205 Ack=290 Win=64311 Len=0;
206;2.224.913;192.168.1.100;192.168.1.103;Modbus/TCP;66;   Query: Trans:    73;" Unit:   1, Func:   3: Read Holding Registers"""
213;2.289.959;192.168.1.100;192.168.1.103;TCP;54;51003  >  502 [ACK] Seq=217 Ack=307 Win=64294 Len=0;
220;2.368.594;192.168.1.100;192.168.1.103;Modbus/TCP;66;   Query: Trans:    74;" Unit:   1, Func:   3: Read Holding Registers"""
229;2.461.120;192.168.1.100;192.168.1.103;TCP;54;51003  >  502 [ACK] Seq=229 Ack=324 Win=64277 Len=0;
232;2.513.902;192.168.1.100;192.168.1.103;Modbus/TCP;66;   Query: Trans:    75;" Unit:   1, Func:   3: Read Holding Registers"""
241;2.586.192;192.168.1.100;192.168.1.103;TCP;54;51003  >  502 [ACK] Seq=241 Ack=341 Win=64260 Len=0;
244;2.652.434;192.168.1.100;192.168.1.103;Modbus/TCP;66;   Query: Trans:    76;" Unit:   1, Func:   3: Read Holding Registers"""
250;2.711.911;192.168.1.100;192.168.1.103;TCP;54;51003  >  502 [ACK] Seq=253 Ack=358 Win=65535 Len=0;
255;2.771.381;192.168.1.100;192.168.1.103;Modbus/TCP;66;   Query: Trans:    77;" Unit:   1, Func:   3: Read Holding Registers"""
262;2.837.199;192.168.1.100;192.168.1.103;TCP;54;51003  >  502 [ACK] Seq=265 Ack=375 Win=65518 Len=0;
267;2.902.012;192.168.1.100;192.168.1.103;Modbus/TCP;66;   Query: Trans:    78;" Unit:   1, Func:   3: Read Holding Registers"""
274;2.978.693;192.168.1.100;192.168.1.103;TCP;54;51003  >  502 [ACK] Seq=277 Ack=392 Win=65501 Len=0;
279;3.028.150;192.168.1.100;192.168.1.103;Modbus/TCP;66;   Query: Trans:    79;" Unit:   1, Func:   3: Read Holding Registers"""
287;3.104.230;192.168.1.100;192.168.1.103;TCP;54;51003  >  502 [ACK] Seq=289 Ack=409 Win=65484 Len=0;
291;3.161.609;192.168.1.100;192.168.1.103;Modbus/TCP;66;   Query: Trans:    80;" Unit:   1, Func:   3: Read Holding Registers"""
299;3.228.922;192.168.1.100;192.168.1.103;TCP;54;51003  >  502 [ACK] Seq=301 Ack=426 Win=65467 Len=0;
303;3.285.201;192.168.1.100;192.168.1.103;Modbus/TCP;66;   Query: Trans:    81;" Unit:   1, Func:   3: Read Holding Registers"""
310;3.352.692;192.168.1.100;192.168.1.103;TCP;54;51003  >  502 [ACK] Seq=313 Ack=443 Win=65450 Len=0;
315;3.414.053;192.168.1.100;192.168.1.103;Modbus/TCP;66;   Query: Trans:    82;" Unit:   1, Func:   3: Read Holding Registers"""
322;3.494.269;192.168.1.100;192.168.1.103;TCP;54;51003  >  502 [ACK] Seq=325 Ack=460 Win=65433 Len=0;
327;3.552.140;192.168.1.100;192.168.1.103;Modbus/TCP;66;   Query: Trans:    83;" Unit:   1, Func:   3: Read Holding Registers"""
335;3.619.873;192.168.1.100;192.168.1.103;TCP;54;51003  >  502 [ACK] Seq=337 Ack=477 Win=65416 Len=0;
339;3.680.591;192.168.1.100;192.168.1.103;Modbus/TCP;66;   Query: Trans:    84;" Unit:   1, Func:   3: Read Holding Registers"""
347;3.743.788;192.168.1.100;192.168.1.103;TCP;54;51003  >  502 [ACK] Seq=349 Ack=494 Win=65399 Len=0;
351;3.804.317;192.168.1.100;192.168.1.103;Modbus/TCP;66;   Query: Trans:    85;" Unit:   1, Func:   3: Read Holding Registers"""
359;3.885.036;192.168.1.100;192.168.1.103;TCP;54;51003  >  502 [ACK] Seq=361 Ack=511 Win=65382 Len=0;
363;3.940.636;192.168.1.100;192.168.1.103;Modbus/TCP;66;   Query: Trans:    86;" Unit:   1, Func:   3: Read Holding Registers"""
372;4.024.900;192.168.1.100;192.168.1.103;TCP;54;51003  >  502 [ACK] Seq=373 Ack=528 Win=65365 Len=0;
376;4.073.303;192.168.1.100;192.168.1.103;Modbus/TCP;66;   Query: Trans:    87;" Unit:   1, Func:   3: Read Holding Registers"""
383;4.152.321;192.168.1.100;192.168.1.103;TCP;54;51003  >  502 [ACK] Seq=385 Ack=545 Win=65348 Len=0;
388;4.223.570;192.168.1.100;192.168.1.103;Modbus/TCP;66;   Query: Trans:    88;" Unit:   1, Func:   3: Read Holding Registers"""
398;4.293.375;192.168.1.100;192.168.1.103;TCP;54;51003  >  502 [ACK] Seq=397 Ack=562 Win=65331 Len=0;
401;4.343.414;192.168.1.100;192.168.1.103;Modbus/TCP;66;   Query: Trans:    89;" Unit:   1, Func:   3: Read Holding Registers"""
410;4.418.182;192.168.1.100;192.168.1.103;TCP;54;51003  >  502 [ACK] Seq=409 Ack=579 Win=65314 Len=0;
415;4.497.447;192.168.1.100;192.168.1.103;Modbus/TCP;66;   Query: Trans:    90;" Unit:   1, Func:   3: Read Holding Registers"""
422;4.559.580;192.168.1.100;192.168.1.103;TCP;54;51003  >  502 [ACK] Seq=421 Ack=596 Win=65297 Len=0;
425;4.610.871;192.168.1.100;192.168.1.103;Modbus/TCP;66;   Query: Trans:    91;" Unit:   1, Func:   3: Read Holding Registers"""
434;4.685.676;192.168.1.100;192.168.1.103;TCP;54;51003  >  502 [ACK] Seq=433 Ack=613 Win=65280 Len=0;
439;4.751.788;192.168.1.100;192.168.1.103;Modbus/TCP;66;   Query: Trans:    92;" Unit:   1, Func:   3: Read Holding Registers"""
446;4.826.091;192.168.1.100;192.168.1.103;TCP;54;51003  >  502 [ACK] Seq=445 Ack=630 Win=65263 Len=0;
451;4.885.614;192.168.1.100;192.168.1.103;Modbus/TCP;66;   Query: Trans:    93;" Unit:   1, Func:   3: Read Holding Registers"""
458;4.951.339;192.168.1.100;192.168.1.103;TCP;54;51003  >  502 [ACK] Seq=457 Ack=647 Win=65246 Len=0;
463;5.024.880;192.168.1.100;192.168.1.103;Modbus/TCP;66;   Query: Trans:    94;" Unit:   1, Func:   3: Read Holding Registers"""
470;5.078.749;192.168.1.100;192.168.1.103;TCP;54;51003  >  502 [ACK] Seq=469 Ack=664 Win=65229 Len=0;
475;5.140.239;192.168.1.100;192.168.1.103;Modbus/TCP;66;   Query: Trans:    95;" Unit:   1, Func:   3: Read Holding Registers"""
480;5.205.036;192.168.1.100;192.168.1.103;TCP;54;51003  >  502 [ACK] Seq=481 Ack=681 Win=65212 Len=0;
486;5.267.613;192.168.1.100;192.168.1.103;Modbus/TCP;66;   Query: Trans:    96;" Unit:   1, Func:   3: Read Holding Registers"""
492;5.346.005;192.168.1.100;192.168.1.103;TCP;54;51003  >  502 [ACK] Seq=493 Ack=698 Win=65195 Len=0;
499;5.394.969;192.168.1.100;192.168.1.103;Modbus/TCP;66;   Query: Trans:    97;" Unit:   1, Func:   3: Read Holding Registers"""
504;5.471.092;192.168.1.100;192.168.1.103;TCP;54;51003  >  502 [ACK] Seq=505 Ack=715 Win=65178 Len=0;
511;5.537.746;192.168.1.100;192.168.1.103;Modbus/TCP;66;   Query: Trans:    98;" Unit:   1, Func:   3: Read Holding Registers"""
516;5.594.055;192.168.1.100;192.168.1.103;TCP;54;51003  >  502 [ACK] Seq=517 Ack=732 Win=65161 Len=0;
523;5.674.392;192.168.1.100;192.168.1.103;Modbus/TCP;66;   Query: Trans:    99;" Unit:   1, Func:   3: Read Holding Registers"""
530;5.766.757;192.168.1.100;192.168.1.103;TCP;54;51003  >  502 [ACK] Seq=529 Ack=749 Win=65144 Len=0;
535;5.822.915;192.168.1.100;192.168.1.103;Modbus/TCP;66;   Query: Trans:   100;" Unit:   1, Func:   3: Read Holding Registers"""
543;5.891.347;192.168.1.100;192.168.1.103;TCP;54;51003  >  502 [ACK] Seq=541 Ack=766 Win=65127 Len=0;
547;5.950.989;192.168.1.100;192.168.1.103;Modbus/TCP;66;   Query: Trans:   101;" Unit:   1, Func:   3: Read Holding Registers"""
554;6.017.531;192.168.1.100;192.168.1.103;TCP;54;51003  >  502 [ACK] Seq=553 Ack=783 Win=65110 Len=0;
559;6.078.876;192.168.1.100;192.168.1.103;Modbus/TCP;66;   Query: Trans:   102;" Unit:   1, Func:   3: Read Holding Registers"""
567;6.158.040;192.168.1.100;192.168.1.103;TCP;54;51003  >  502 [ACK] Seq=565 Ack=800 Win=65093 Len=0;
572;6.210.124;192.168.1.100;192.168.1.103;Modbus/TCP;66;   Query: Trans:   103;" Unit:   1, Func:   3: Read Holding Registers"""
579;6.282.415;192.168.1.100;192.168.1.103;TCP;54;51003  >  502 [ACK] Seq=577 Ack=817 Win=65076 Len=0;
583;6.344.953;192.168.1.100;192.168.1.103;Modbus/TCP;66;   Query: Trans:   104;" Unit:   1, Func:   3: Read Holding Registers"""
590;6.407.844;192.168.1.100;192.168.1.103;TCP;54;51003  >  502 [ACK] Seq=589 Ack=834 Win=65059 Len=0;
595;6.463.607;192.168.1.100;192.168.1.103;Modbus/TCP;66;   Query: Trans:   105;" Unit:   1, Func:   3: Read Holding Registers"""
602;6.532.193;192.168.1.100;192.168.1.103;TCP;54;51003  >  502 [ACK] Seq=601 Ack=851 Win=65042 Len=0;
607;6.591.605;192.168.1.100;192.168.1.103;Modbus/TCP;66;   Query: Trans:   106;" Unit:   1, Func:   3: Read Holding Registers"""
615;6.670.757;192.168.1.100;192.168.1.103;TCP;54;51003  >  502 [ACK] Seq=613 Ack=868 Win=65025 Len=0;
620;6.719.374;192.168.1.100;192.168.1.103;Modbus/TCP;66;   Query: Trans:   107;" Unit:   1, Func:   3: Read Holding Registers"""
627;6.794.711;192.168.1.100;192.168.1.103;TCP;54;51003  >  502 [ACK] Seq=625 Ack=885 Win=65008 Len=0;
631;6.848.656;192.168.1.100;192.168.1.103;Modbus/TCP;66;   Query: Trans:   108;" Unit:   1, Func:   3: Read Holding Registers"""
639;6.919.301;192.168.1.100;192.168.1.103;TCP;54;51003  >  502 [ACK] Seq=637 Ack=902 Win=64991 Len=0;
643;6.976.446;192.168.1.100;192.168.1.103;Modbus/TCP;66;   Query: Trans:   109;" Unit:   1, Func:   3: Read Holding Registers"""
651;7.044.044;192.168.1.100;192.168.1.103;TCP;54;51003  >  502 [ACK] Seq=649 Ack=919 Win=64974 Len=0;
655;7.105.506;192.168.1.100;192.168.1.103;Modbus/TCP;66;   Query: Trans:   110;" Unit:   1, Func:   3: Read Holding Registers"""
663;7.184.793;192.168.1.100;192.168.1.103;TCP;54;51003  >  502 [ACK] Seq=661 Ack=936 Win=64957 Len=0;
667;7.238.351;192.168.1.100;192.168.1.103;Modbus/TCP;66;   Query: Trans:   111;" Unit:   1, Func:   3: Read Holding Registers"""
675;7.308.879;192.168.1.100;192.168.1.103;TCP;54;51003  >  502 [ACK] Seq=673 Ack=953 Win=64940 Len=0;
679;7.361.608;192.168.1.100;192.168.1.103;Modbus/TCP;66;   Query: Trans:   112;" Unit:   1, Func:   3: Read Holding Registers"""
687;7.434.418;192.168.1.100;192.168.1.103;TCP;54;51003  >  502 [ACK] Seq=685 Ack=970 Win=64923 Len=0;
691;7.489.659;192.168.1.100;192.168.1.103;Modbus/TCP;66;   Query: Trans:   113;" Unit:   1, Func:   3: Read Holding Registers"""
698;7.559.362;192.168.1.100;192.168.1.103;TCP;54;51003  >  502 [ACK] Seq=697 Ack=987 Win=64906 Len=0;
704;7.621.410;192.168.1.100;192.168.1.103;Modbus/TCP;66;   Query: Trans:   114;" Unit:   1, Func:   3: Read Holding Registers"""
711;7.699.183;192.168.1.100;192.168.1.103;TCP;54;51003  >  502 [ACK] Seq=709 Ack=1004 Win=64889 Len=0;
716;7.752.181;192.168.1.100;192.168.1.103;Modbus/TCP;66;   Query: Trans:   115;" Unit:   1, Func:   3: Read Holding Registers"""
723;7.825.625;192.168.1.100;192.168.1.103;TCP;54;51003  >  502 [ACK] Seq=721 Ack=1021 Win=64872 Len=0;
727;7.882.469;192.168.1.100;192.168.1.103;Modbus/TCP;66;   Query: Trans:   116;" Unit:   1, Func:   3: Read Holding Registers"""
735;7.951.624;192.168.1.100;192.168.1.103;TCP;54;51003  >  502 [ACK] Seq=733 Ack=1038 Win=64855 Len=0;
739;8.006.940;192.168.1.100;192.168.1.103;Modbus/TCP;66;   Query: Trans:   117;" Unit:   1, Func:   3: Read Holding Registers"""
746;8.076.691;192.168.1.100;192.168.1.103;TCP;54;51003  >  502 [ACK] Seq=745 Ack=1055 Win=64838 Len=0;
751;8.137.759;192.168.1.100;192.168.1.103;Modbus/TCP;66;   Query: Trans:   118;" Unit:   1, Func:   3: Read Holding Registers"""
758;8.201.587;192.168.1.100;192.168.1.103;TCP;54;51003  >  502 [ACK] Seq=757 Ack=1072 Win=64821 Len=0;
763;8.287.173;192.168.1.100;192.168.1.103;Modbus/TCP;66;   Query: Trans:   119;" Unit:   1, Func:   3: Read Holding Registers"""
772;8.373.046;192.168.1.100;192.168.1.103;TCP;54;51003  >  502 [ACK] Seq=769 Ack=1089 Win=64804 Len=0;
777;8.470.827;192.168.1.100;192.168.1.103;Modbus/TCP;66;   Query: Trans:   120;" Unit:   1, Func:   3: Read Holding Registers"""
786;8.543.910;192.168.1.100;192.168.1.103;TCP;54;51003  >  502 [ACK] Seq=781 Ack=1106 Win=64787 Len=0;
789;8.604.709;192.168.1.100;192.168.1.103;Modbus/TCP;66;   Query: Trans:   121;" Unit:   1, Func:   3: Read Holding Registers"""
798;8.684.509;192.168.1.100;192.168.1.103;TCP;54;51003  >  502 [ACK] Seq=793 Ack=1123 Win=64770 Len=0;
803;8.742.310;192.168.1.100;192.168.1.103;Modbus/TCP;66;   Query: Trans:   122;" Unit:   1, Func:   3: Read Holding Registers"""
810;8.809.429;192.168.1.100;192.168.1.103;TCP;54;51003  >  502 [ACK] Seq=805 Ack=1140 Win=64753 Len=0;
815;8.873.263;192.168.1.100;192.168.1.103;Modbus/TCP;66;   Query: Trans:   123;" Unit:   1, Func:   3: Read Holding Registers"""
822;8.932.953;192.168.1.100;192.168.1.103;TCP;54;51003  >  502 [ACK] Seq=817 Ack=1157 Win=64736 Len=0;
827;8.994.769;192.168.1.100;192.168.1.103;Modbus/TCP;66;   Query: Trans:   124;" Unit:   1, Func:   3: Read Holding Registers"""
832;9.074.032;192.168.1.100;192.168.1.103;TCP;54;51003  >  502 [ACK] Seq=829 Ack=1174 Win=64719 Len=0;
839;9.130.831;192.168.1.100;192.168.1.103;Modbus/TCP;66;   Query: Trans:   125;" Unit:   1, Func:   3: Read Holding Registers"""
844;9.200.119;192.168.1.100;192.168.1.103;TCP;54;51003  >  502 [ACK] Seq=841 Ack=1191 Win=64702 Len=0;
851;9.259.459;192.168.1.100;192.168.1.103;Modbus/TCP;66;   Query: Trans:   126;" Unit:   1, Func:   3: Read Holding Registers"""
858;9.339.591;192.168.1.100;192.168.1.103;TCP;54;51003  >  502 [ACK] Seq=853 Ack=1208 Win=64685 Len=0;
863;9.395.361;192.168.1.100;192.168.1.103;Modbus/TCP;66;   Query: Trans:   127;" Unit:   1, Func:   3: Read Holding Registers"""
870;9.465.045;192.168.1.100;192.168.1.103;TCP;54;51003  >  502 [ACK] Seq=865 Ack=1225 Win=64668 Len=0;
875;9.534.751;192.168.1.100;192.168.1.103;Modbus/TCP;66;   Query: Trans:   128;" Unit:   1, Func:   3: Read Holding Registers"""
880;9.603.995;192.168.1.100;192.168.1.103;TCP;54;51003  >  502 [ACK] Seq=877 Ack=1242 Win=64651 Len=0;
886;9.662.684;192.168.1.100;192.168.1.103;Modbus/TCP;66;   Query: Trans:   129;" Unit:   1, Func:   3: Read Holding Registers"""
893;9.744.032;192.168.1.100;192.168.1.103;TCP;54;51003  >  502 [ACK] Seq=889 Ack=1259 Win=64634 Len=0;
898;9.806.069;192.168.1.100;192.168.1.103;Modbus/TCP;66;   Query: Trans:   130;" Unit:   1, Func:   3: Read Holding Registers"""
903;9.869.931;192.168.1.100;192.168.1.103;TCP;54;51003  >  502 [ACK] Seq=901 Ack=1276 Win=64617 Len=0;
912;9.942.492;192.168.1.100;192.168.1.103;Modbus/TCP;66;   Query: Trans:   131;" Unit:   1, Func:   3: Read Holding Registers"""
917;10.010.599;192.168.1.100;192.168.1.103;TCP;54;51003  >  502 [ACK] Seq=913 Ack=1293 Win=64600 Len=0;
924;10.089.695;192.168.1.100;192.168.1.103;Modbus/TCP;66;   Query: Trans:   132;" Unit:   1, Func:   3: Read Holding Registers"""
933;10.151.264;192.168.1.100;192.168.1.103;TCP;54;51003  >  502 [ACK] Seq=925 Ack=1310 Win=64583 Len=0;
936;10.213.090;192.168.1.100;192.168.1.103;Modbus/TCP;66;   Query: Trans:   133;" Unit:   1, Func:   3: Read Holding Registers"""
945;10.275.773;192.168.1.100;192.168.1.103;TCP;54;51003  >  502 [ACK] Seq=937 Ack=1327 Win=64566 Len=0;
948;10.337.145;192.168.1.100;192.168.1.103;Modbus/TCP;66;   Query: Trans:   134;" Unit:   1, Func:   3: Read Holding Registers"""
957;10.415.770;192.168.1.100;192.168.1.103;TCP;54;51003  >  502 [ACK] Seq=949 Ack=1344 Win=64549 Len=0;
960;10.464.065;192.168.1.100;192.168.1.103;Modbus/TCP;66;   Query: Trans:   135;" Unit:   1, Func:   3: Read Holding Registers"""
969;10.541.900;192.168.1.100;192.168.1.103;TCP;54;51003  >  502 [ACK] Seq=961 Ack=1361 Win=64532 Len=0;
972;10.611.315;192.168.1.100;192.168.1.103;Modbus/TCP;66;   Query: Trans:   136;" Unit:   1, Func:   3: Read Holding Registers"""
979;10.666.541;192.168.1.100;192.168.1.103;TCP;54;51003  >  502 [ACK] Seq=973 Ack=1378 Win=64515 Len=0;
983;10.724.008;192.168.1.100;192.168.1.103;Modbus/TCP;66;   Query: Trans:   137;" Unit:   1, Func:   3: Read Holding Registers"""
990;10.793.072;192.168.1.100;192.168.1.103;TCP;54;51003  >  502 [ACK] Seq=985 Ack=1395 Win=64498 Len=0;
995;10.851.796;192.168.1.100;192.168.1.103;Modbus/TCP;66;   Query: Trans:   138;" Unit:   1, Func:   3: Read Holding Registers"""
1002;10.934.192;192.168.1.100;192.168.1.103;TCP;54;51003  >  502 [ACK] Seq=997 Ack=1412 Win=64481 Len=0;
1007;10.991.130;192.168.1.100;192.168.1.103;Modbus/TCP;66;   Query: Trans:   139;" Unit:   1, Func:   3: Read Holding Registers"""
1014;11.059.247;192.168.1.100;192.168.1.103;TCP;54;51003  >  502 [ACK] Seq=1009 Ack=1429 Win=64464 Len=0;
1019;11.120.158;192.168.1.100;192.168.1.103;Modbus/TCP;66;   Query: Trans:   140;" Unit:   1, Func:   3: Read Holding Registers"""
1026;11.186.132;192.168.1.100;192.168.1.103;TCP;54;51003  >  502 [ACK] Seq=1021 Ack=1446 Win=64447 Len=0;
1031;11.243.180;192.168.1.100;192.168.1.103;Modbus/TCP;66;   Query: Trans:   141;" Unit:   1, Func:   3: Read Holding Registers"""
1038;11.310.309;192.168.1.100;192.168.1.103;TCP;54;51003  >  502 [ACK] Seq=1033 Ack=1463 Win=64430 Len=0;
1043;11.368.457;192.168.1.100;192.168.1.103;Modbus/TCP;66;   Query: Trans:   142;" Unit:   1, Func:   3: Read Holding Registers"""
1050;11.436.837;192.168.1.100;192.168.1.103;TCP;54;51003  >  502 [ACK] Seq=1045 Ack=1480 Win=64413 Len=0;
1055;11.513.817;192.168.1.100;192.168.1.103;Modbus/TCP;66;   Query: Trans:   143;" Unit:   1, Func:   3: Read Holding Registers"""
1063;11.577.851;192.168.1.100;192.168.1.103;TCP;54;51003  >  502 [ACK] Seq=1057 Ack=1497 Win=64396 Len=0;
1067;11.636.086;192.168.1.100;192.168.1.103;Modbus/TCP;66;   Query: Trans:   144;" Unit:   1, Func:   3: Read Holding Registers"""
1074;11.702.826;192.168.1.100;192.168.1.103;TCP;54;51003  >  502 [ACK] Seq=1069 Ack=1514 Win=64379 Len=0;
1079;11.756.176;192.168.1.100;192.168.1.103;Modbus/TCP;66;   Query: Trans:   145;" Unit:   1, Func:   3: Read Holding Registers"""
1086;11.829.407;192.168.1.100;192.168.1.103;TCP;54;51003  >  502 [ACK] Seq=1081 Ack=1531 Win=64362 Len=0;
1091;11.885.410;192.168.1.100;192.168.1.103;Modbus/TCP;66;   Query: Trans:   146;" Unit:   1, Func:   3: Read Holding Registers"""
1098;11.953.926;192.168.1.100;192.168.1.103;TCP;54;51003  >  502 [ACK] Seq=1093 Ack=1548 Win=64345 Len=0;
1104;12.038.406;192.168.1.100;192.168.1.103;Modbus/TCP;66;   Query: Trans:   147;" Unit:   1, Func:   3: Read Holding Registers"""
1111;12.094.478;192.168.1.100;192.168.1.103;TCP;54;51003  >  502 [ACK] Seq=1105 Ack=1565 Win=64328 Len=0;
1116;12.159.809;192.168.1.100;192.168.1.103;Modbus/TCP;66;   Query: Trans:   148;" Unit:   1, Func:   3: Read Holding Registers"""
1122;12.220.091;192.168.1.100;192.168.1.103;TCP;54;51003  >  502 [ACK] Seq=1117 Ack=1582 Win=64311 Len=0;
1127;12.276.587;192.168.1.100;192.168.1.103;Modbus/TCP;66;   Query: Trans:   149;" Unit:   1, Func:   3: Read Holding Registers"""
1135;12.358.189;192.168.1.100;192.168.1.103;TCP;54;51003  >  502 [ACK] Seq=1129 Ack=1599 Win=64294 Len=0;
1139;12.406.863;192.168.1.100;192.168.1.103;Modbus/TCP;66;   Query: Trans:   150;" Unit:   1, Func:   3: Read Holding Registers"""
1146;12.483.608;192.168.1.100;192.168.1.103;TCP;54;51003  >  502 [ACK] Seq=1141 Ack=1616 Win=64277 Len=0;
1152;12.547.632;192.168.1.100;192.168.1.103;Modbus/TCP;66;   Query: Trans:   151;" Unit:   1, Func:   3: Read Holding Registers"""
1158;12.624.687;192.168.1.100;192.168.1.103;TCP;54;51003  >  502 [ACK] Seq=1153 Ack=1633 Win=64260 Len=0;
1163;12.681.387;192.168.1.100;192.168.1.103;Modbus/TCP;66;   Query: Trans:   152;" Unit:   1, Func:   3: Read Holding Registers"""
1170;12.752.030;192.168.1.100;192.168.1.103;TCP;54;51003  >  502 [ACK] Seq=1165 Ack=1650 Win=65535 Len=0;
1176;12.827.671;192.168.1.100;192.168.1.103;Modbus/TCP;66;   Query: Trans:   153;" Unit:   1, Func:   3: Read Holding Registers"""
1183;12.892.555;192.168.1.100;192.168.1.103;TCP;54;51003  >  502 [ACK] Seq=1177 Ack=1667 Win=65518 Len=0;
1187;12.958.506;192.168.1.100;192.168.1.103;Modbus/TCP;66;   Query: Trans:   154;" Unit:   1, Func:   3: Read Holding Registers"""
1194;13.017.195;192.168.1.100;192.168.1.103;TCP;54;51003  >  502 [ACK] Seq=1189 Ack=1684 Win=65501 Len=0;
1199;13.069.430;192.168.1.100;192.168.1.103;Modbus/TCP;66;   Query: Trans:   155;" Unit:   1, Func:   3: Read Holding Registers"""
1207;13.143.453;192.168.1.100;192.168.1.103;TCP;54;51003  >  502 [ACK] Seq=1201 Ack=1701 Win=65484 Len=0;
1216;13.217.012;192.168.1.100;192.168.1.103;Modbus/TCP;66;   Query: Trans:   156;" Unit:   1, Func:   3: Read Holding Registers"""
1227;13.310.865;192.168.1.100;192.168.1.103;TCP;54;51003  >  502 [ACK] Seq=1213 Ack=1718 Win=65467 Len=0;
1232;13.370.415;192.168.1.100;192.168.1.103;Modbus/TCP;66;   Query: Trans:   157;" Unit:   1, Func:   3: Read Holding Registers"""
1238;13.449.908;192.168.1.100;192.168.1.103;TCP;54;51003  >  502 [ACK] Seq=1225 Ack=1735 Win=65450 Len=0;
1242;13.499.325;192.168.1.100;192.168.1.103;Modbus/TCP;66;   Query: Trans:   158;" Unit:   1, Func:   3: Read Holding Registers"""
1249;13.575.681;192.168.1.100;192.168.1.103;TCP;54;51003  >  502 [ACK] Seq=1237 Ack=1752 Win=65433 Len=0;
1254;13.636.884;192.168.1.100;192.168.1.103;Modbus/TCP;66;   Query: Trans:   159;" Unit:   1, Func:   3: Read Holding Registers"""
1259;13.700.815;192.168.1.100;192.168.1.103;TCP;54;51003  >  502 [ACK] Seq=1249 Ack=1769 Win=65416 Len=0;
1266;13.757.520;192.168.1.100;192.168.1.103;Modbus/TCP;66;   Query: Trans:   160;" Unit:   1, Func:   3: Read Holding Registers"""
1271;13.824.867;192.168.1.100;192.168.1.103;TCP;54;51003  >  502 [ACK] Seq=1261 Ack=1786 Win=65399 Len=0;
1278;13.893.698;192.168.1.100;192.168.1.103;Modbus/TCP;66;   Query: Trans:   161;" Unit:   1, Func:   3: Read Holding Registers"""
1283;13.951.314;192.168.1.100;192.168.1.103;TCP;54;51003  >  502 [ACK] Seq=1273 Ack=1803 Win=65382 Len=0;
1290;14.028.472;192.168.1.100;192.168.1.103;Modbus/TCP;66;   Query: Trans:   162;" Unit:   1, Func:   3: Read Holding Registers"""
1295;14.077.383;192.168.1.100;192.168.1.103;TCP;54;51003  >  502 [ACK] Seq=1285 Ack=1820 Win=65365 Len=0;
1302;14.161.358;192.168.1.100;192.168.1.103;Modbus/TCP;66;   Query: Trans:   163;" Unit:   1, Func:   3: Read Holding Registers"""
1309;14.218.151;192.168.1.100;192.168.1.103;TCP;54;51003  >  502 [ACK] Seq=1297 Ack=1837 Win=65348 Len=0;
1314;14.271.122;192.168.1.100;192.168.1.103;Modbus/TCP;66;   Query: Trans:   164;" Unit:   1, Func:   3: Read Holding Registers"""
1319;14.343.250;192.168.1.100;192.168.1.103;TCP;54;51003  >  502 [ACK] Seq=1309 Ack=1854 Win=65331 Len=0;
1326;14.399.151;192.168.1.100;192.168.1.103;Modbus/TCP;66;   Query: Trans:   165;" Unit:   1, Func:   3: Read Holding Registers"""
1331;14.468.209;192.168.1.100;192.168.1.103;TCP;54;51003  >  502 [ACK] Seq=1321 Ack=1871 Win=65314 Len=0;
1338;14.536.207;192.168.1.100;192.168.1.103;Modbus/TCP;66;   Query: Trans:   166;" Unit:   1, Func:   3: Read Holding Registers"""
1343;14.592.769;192.168.1.100;192.168.1.103;TCP;54;51003  >  502 [ACK] Seq=1333 Ack=1888 Win=65297 Len=0;
1350;14.671.304;192.168.1.100;192.168.1.103;Modbus/TCP;66;   Query: Trans:   167;" Unit:   1, Func:   3: Read Holding Registers"""
1357;14.732.302;192.168.1.100;192.168.1.103;TCP;54;51003  >  502 [ACK] Seq=1345 Ack=1905 Win=65280 Len=0;
1362;14.783.852;192.168.1.100;192.168.1.103;Modbus/TCP;66;   Query: Trans:   168;" Unit:   1, Func:   3: Read Holding Registers"""
1369;14.857.935;192.168.1.100;192.168.1.103;TCP;54;51003  >  502 [ACK] Seq=1357 Ack=1922 Win=65263 Len=0;
1374;14.913.220;192.168.1.100;192.168.1.103;Modbus/TCP;66;   Query: Trans:   169;" Unit:   1, Func:   3: Read Holding Registers"""
1379;14.981.852;192.168.1.100;192.168.1.103;TCP;54;51003  >  502 [ACK] Seq=1369 Ack=1939 Win=65246 Len=0;
1386;15.064.133;192.168.1.100;192.168.1.103;Modbus/TCP;66;   Query: Trans:   170;" Unit:   1, Func:   3: Read Holding Registers"""
1391;15.107.713;192.168.1.100;192.168.1.103;TCP;54;51003  >  502 [ACK] Seq=1381 Ack=1956 Win=65229 Len=0;
1398;15.183.612;192.168.1.100;192.168.1.103;Modbus/TCP;66;   Query: Trans:   171;" Unit:   1, Func:   3: Read Holding Registers"""
1405;15.247.512;192.168.1.100;192.168.1.103;TCP;54;51003  >  502 [ACK] Seq=1393 Ack=1973 Win=65212 Len=0;
1408;15.297.905;192.168.1.100;192.168.1.103;Modbus/TCP;66;   Query: Trans:   172;" Unit:   1, Func:   3: Read Holding Registers"""
1416;15.373.485;192.168.1.100;192.168.1.103;TCP;54;51003  >  502 [ACK] Seq=1405 Ack=1990 Win=65195 Len=0;
1419;15.426.177;192.168.1.100;192.168.1.103;Modbus/TCP;66;   Query: Trans:   173;" Unit:   1, Func:   3: Read Holding Registers"""
1426;15.499.625;192.168.1.100;192.168.1.103;TCP;54;51003  >  502 [ACK] Seq=1417 Ack=2007 Win=65178 Len=0;
1431;15.558.567;192.168.1.100;192.168.1.103;Modbus/TCP;66;   Query: Trans:   174;" Unit:   1, Func:   3: Read Holding Registers"""
1437;15.623.515;192.168.1.100;192.168.1.103;TCP;54;51003  >  502 [ACK] Seq=1429 Ack=2024 Win=65161 Len=0;
1443;15.681.830;192.168.1.100;192.168.1.103;Modbus/TCP;66;   Query: Trans:   175;" Unit:   1, Func:   3: Read Holding Registers"""
1452;15.762.298;192.168.1.100;192.168.1.103;TCP;54;51003  >  502 [ACK] Seq=1441 Ack=2041 Win=65144 Len=0;
1455;15.810.983;192.168.1.100;192.168.1.103;Modbus/TCP;66;   Query: Trans:   176;" Unit:   1, Func:   3: Read Holding Registers"""
1465;15.887.247;192.168.1.100;192.168.1.103;TCP;54;51003  >  502 [ACK] Seq=1453 Ack=2058 Win=65127 Len=0;
1467;15.947.557;192.168.1.100;192.168.1.103;Modbus/TCP;66;   Query: Trans:   177;" Unit:   1, Func:   3: Read Holding Registers"""
1474;16.010.307;192.168.1.100;192.168.1.103;TCP;54;51003  >  502 [ACK] Seq=1465 Ack=2075 Win=65110 Len=0;
1479;16.074.346;192.168.1.100;192.168.1.103;Modbus/TCP;66;   Query: Trans:   178;" Unit:   1, Func:   3: Read Holding Registers"""
1485;16.135.487;192.168.1.100;192.168.1.103;TCP;54;51003  >  502 [ACK] Seq=1477 Ack=2092 Win=65093 Len=0;
1490;16.195.365;192.168.1.100;192.168.1.103;Modbus/TCP;66;   Query: Trans:   179;" Unit:   1, Func:   3: Read Holding Registers"""
1498;16.276.176;192.168.1.100;192.168.1.103;TCP;54;51003  >  502 [ACK] Seq=1489 Ack=2109 Win=65076 Len=0;
1502;16.325.773;192.168.1.100;192.168.1.103;Modbus/TCP;66;   Query: Trans:   180;" Unit:   1, Func:   3: Read Holding Registers"""
1509;16.401.183;192.168.1.100;192.168.1.103;TCP;54;51003  >  502 [ACK] Seq=1501 Ack=2126 Win=65059 Len=0;
1514;16.468.105;192.168.1.100;192.168.1.103;Modbus/TCP;66;   Query: Trans:   181;" Unit:   1, Func:   3: Read Holding Registers"""
1519;16.524.884;192.168.1.100;192.168.1.103;TCP;54;51003  >  502 [ACK] Seq=1513 Ack=2143 Win=65042 Len=0;
1526;16.602.218;192.168.1.100;192.168.1.103;Modbus/TCP;66;   Query: Trans:   182;" Unit:   1, Func:   3: Read Holding Registers"""
1531;16.650.670;192.168.1.100;192.168.1.103;TCP;54;51003  >  502 [ACK] Seq=1525 Ack=2160 Win=65025 Len=0;
1538;16.710.552;192.168.1.100;192.168.1.103;Modbus/TCP;66;   Query: Trans:   183;" Unit:   1, Func:   3: Read Holding Registers"""
1543;16.776.270;192.168.1.100;192.168.1.103;TCP;54;51003  >  502 [ACK] Seq=1537 Ack=2177 Win=65008 Len=0;
1550;16.841.704;192.168.1.100;192.168.1.103;Modbus/TCP;66;   Query: Trans:   184;" Unit:   1, Func:   3: Read Holding Registers"""
1557;16.916.119;192.168.1.100;192.168.1.103;TCP;54;51003  >  502 [ACK] Seq=1549 Ack=2194 Win=64991 Len=0;
1562;16.984.378;192.168.1.100;192.168.1.103;Modbus/TCP;66;   Query: Trans:   185;" Unit:   1, Func:   3: Read Holding Registers"""
1569;17.042.758;192.168.1.100;192.168.1.103;TCP;54;51003  >  502 [ACK] Seq=1561 Ack=2211 Win=64974 Len=0;
1574;17.097.254;192.168.1.100;192.168.1.103;Modbus/TCP;66;   Query: Trans:   186;" Unit:   1, Func:   3: Read Holding Registers"""
1580;17.168.546;192.168.1.100;192.168.1.103;TCP;54;51003  >  502 [ACK] Seq=1573 Ack=2228 Win=64957 Len=0;
1586;17.234.289;192.168.1.100;192.168.1.103;Modbus/TCP;66;   Query: Trans:   187;" Unit:   1, Func:   3: Read Holding Registers"""
1591;17.290.751;192.168.1.100;192.168.1.103;TCP;54;51003  >  502 [ACK] Seq=1585 Ack=2245 Win=64940 Len=0;
1598;17.364.060;192.168.1.100;192.168.1.103;Modbus/TCP;66;   Query: Trans:   188;" Unit:   1, Func:   3: Read Holding Registers"""
1605;17.430.301;192.168.1.100;192.168.1.103;TCP;54;51003  >  502 [ACK] Seq=1597 Ack=2262 Win=64923 Len=0;
1610;17.499.231;192.168.1.100;192.168.1.103;Modbus/TCP;66;   Query: Trans:   189;" Unit:   1, Func:   3: Read Holding Registers"""
1617;17.554.108;192.168.1.100;192.168.1.103;TCP;54;51003  >  502 [ACK] Seq=1609 Ack=2279 Win=64906 Len=0;
1622;17.610.312;192.168.1.100;192.168.1.103;Modbus/TCP;66;   Query: Trans:   190;" Unit:   1, Func:   3: Read Holding Registers"""
1627;17.678.765;192.168.1.100;192.168.1.103;TCP;54;51003  >  502 [ACK] Seq=1621 Ack=2296 Win=64889 Len=0;
1634;17.743.609;192.168.1.100;192.168.1.103;Modbus/TCP;66;   Query: Trans:   191;" Unit:   1, Func:   3: Read Holding Registers"""
1639;17.803.511;192.168.1.100;192.168.1.103;TCP;54;51003  >  502 [ACK] Seq=1633 Ack=2313 Win=64872 Len=0;
1646;17.878.097;192.168.1.100;192.168.1.103;Modbus/TCP;66;   Query: Trans:   192;" Unit:   1, Func:   3: Read Holding Registers"""
1651;17.942.660;192.168.1.100;192.168.1.103;TCP;54;51003  >  502 [ACK] Seq=1645 Ack=2330 Win=64855 Len=0;
1657;17.995.470;192.168.1.100;192.168.1.103;Modbus/TCP;66;   Query: Trans:   193;" Unit:   1, Func:   3: Read Holding Registers"""
1662;18.068.428;192.168.1.100;192.168.1.103;TCP;54;51003  >  502 [ACK] Seq=1657 Ack=2347 Win=64838 Len=0;
1669;18.143.214;192.168.1.100;192.168.1.103;Modbus/TCP;66;   Query: Trans:   194;" Unit:   1, Func:   3: Read Holding Registers"""
1674;18.208.669;192.168.1.100;192.168.1.103;TCP;54;51003  >  502 [ACK] Seq=1669 Ack=2364 Win=64821 Len=0;
1681;18.266.663;192.168.1.100;192.168.1.103;Modbus/TCP;66;   Query: Trans:   195;" Unit:   1, Func:   3: Read Holding Registers"""
1686;18.334.802;192.168.1.100;192.168.1.103;TCP;54;51003  >  502 [ACK] Seq=1681 Ack=2381 Win=64804 Len=0;
1693;18.399.592;192.168.1.100;192.168.1.103;Modbus/TCP;66;   Query: Trans:   196;" Unit:   1, Func:   3: Read Holding Registers"""
1700;18.475.832;192.168.1.100;192.168.1.103;TCP;54;51003  >  502 [ACK] Seq=1693 Ack=2398 Win=64787 Len=0;
1705;18.534.180;192.168.1.100;192.168.1.103;Modbus/TCP;66;   Query: Trans:   197;" Unit:   1, Func:   3: Read Holding Registers"""
1711;18.617.827;192.168.1.100;192.168.1.103;TCP;54;51003  >  502 [ACK] Seq=1705 Ack=2415 Win=64770 Len=0;
1717;18.667.662;192.168.1.100;192.168.1.103;Modbus/TCP;66;   Query: Trans:   198;" Unit:   1, Func:   3: Read Holding Registers"""
1724;18.744.112;192.168.1.100;192.168.1.103;TCP;54;51003  >  502 [ACK] Seq=1717 Ack=2432 Win=64753 Len=0;
1731;18.808.512;192.168.1.100;192.168.1.103;Modbus/TCP;66;   Query: Trans:   199;" Unit:   1, Func:   3: Read Holding Registers"""
1740;18.886.469;192.168.1.100;192.168.1.103;TCP;54;51003  >  502 [ACK] Seq=1729 Ack=2449 Win=64736 Len=0;
1743;18.936.225;192.168.1.100;192.168.1.103;Modbus/TCP;66;   Query: Trans:   200;" Unit:   1, Func:   3: Read Holding Registers"""
1750;19.011.262;192.168.1.100;192.168.1.103;TCP;54;51003  >  502 [ACK] Seq=1741 Ack=2466 Win=64719 Len=0;
1755;19.072.728;192.168.1.100;192.168.1.103;Modbus/TCP;66;   Query: Trans:   201;" Unit:   1, Func:   3: Read Holding Registers"""
1764;19.152.765;192.168.1.100;192.168.1.103;TCP;54;51003  >  502 [ACK] Seq=1753 Ack=2483 Win=64702 Len=0;
1767;19.207.446;192.168.1.100;192.168.1.103;Modbus/TCP;66;   Query: Trans:   202;" Unit:   1, Func:   3: Read Holding Registers"""
1774;19.279.686;192.168.1.100;192.168.1.103;TCP;54;51003  >  502 [ACK] Seq=1765 Ack=2500 Win=64685 Len=0;
1778;19.341.789;192.168.1.100;192.168.1.103;Modbus/TCP;66;   Query: Trans:   203;" Unit:   1, Func:   3: Read Holding Registers"""
1786;19.420.461;192.168.1.100;192.168.1.103;TCP;54;51003  >  502 [ACK] Seq=1777 Ack=2517 Win=64668 Len=0;
1791;19.488.652;192.168.1.100;192.168.1.103;Modbus/TCP;66;   Query: Trans:   204;" Unit:   1, Func:   3: Read Holding Registers"""
1798;19.544.578;192.168.1.100;192.168.1.103;TCP;54;51003  >  502 [ACK] Seq=1789 Ack=2534 Win=64651 Len=0;
1802;19.606.501;192.168.1.100;192.168.1.103;Modbus/TCP;66;   Query: Trans:   205;" Unit:   1, Func:   3: Read Holding Registers"""
1809;19.686.562;192.168.1.100;192.168.1.103;TCP;54;51003  >  502 [ACK] Seq=1801 Ack=2551 Win=64634 Len=0;
1814;19.743.843;192.168.1.100;192.168.1.103;Modbus/TCP;66;   Query: Trans:   206;" Unit:   1, Func:   3: Read Holding Registers"""
1824;19.827.501;192.168.1.100;192.168.1.103;TCP;54;51003  >  502 [ACK] Seq=1813 Ack=2568 Win=64617 Len=0;
1827;19.902.873;192.168.1.100;192.168.1.103;Modbus/TCP;66;   Query: Trans:   207;" Unit:   1, Func:   3: Read Holding Registers"""
1834;19.953.057;192.168.1.100;192.168.1.103;TCP;54;51003  >  502 [ACK] Seq=1825 Ack=2585 Win=64600 Len=0;
1839;20.016.367;192.168.1.100;192.168.1.103;Modbus/TCP;66;   Query: Trans:   208;" Unit:   1, Func:   3: Read Holding Registers"""
1848;20.093.783;192.168.1.100;192.168.1.103;TCP;54;51003  >  502 [ACK] Seq=1837 Ack=2602 Win=64583 Len=0;
1851;20.167.918;192.168.1.100;192.168.1.103;Modbus/TCP;66;   Query: Trans:   209;" Unit:   1, Func:   3: Read Holding Registers"""
1855;20.218.535;192.168.1.100;192.168.1.103;TCP;54;51003  >  502 [ACK] Seq=1849 Ack=2619 Win=64566 Len=0;
1861;20.278.331;192.168.1.100;192.168.1.103;Modbus/TCP;66;   Query: Trans:   210;" Unit:   1, Func:   3: Read Holding Registers"""
1866;20.360.205;192.168.1.100;192.168.1.103;TCP;54;51003  >  502 [ACK] Seq=1861 Ack=2636 Win=64549 Len=0;
1873;20.417.961;192.168.1.100;192.168.1.103;Modbus/TCP;66;   Query: Trans:   211;" Unit:   1, Func:   3: Read Holding Registers"""
1879;20.484.618;192.168.1.100;192.168.1.103;TCP;54;51003  >  502 [ACK] Seq=1873 Ack=2653 Win=64532 Len=0;
1885;20.549.851;192.168.1.100;192.168.1.103;Modbus/TCP;66;   Query: Trans:   212;" Unit:   1, Func:   3: Read Holding Registers"""
1890;20.609.210;192.168.1.100;192.168.1.103;TCP;54;51003  >  502 [ACK] Seq=1885 Ack=2670 Win=64515 Len=0;
1897;20.669.557;192.168.1.100;192.168.1.103;Modbus/TCP;66;   Query: Trans:   213;" Unit:   1, Func:   3: Read Holding Registers"""
1902;20.735.698;192.168.1.100;192.168.1.103;TCP;54;51003  >  502 [ACK] Seq=1897 Ack=2687 Win=64498 Len=0;
1909;20.794.937;192.168.1.100;192.168.1.103;Modbus/TCP;66;   Query: Trans:   214;" Unit:   1, Func:   3: Read Holding Registers"""
1915;20.874.711;192.168.1.100;192.168.1.103;TCP;54;51003  >  502 [ACK] Seq=1909 Ack=2704 Win=64481 Len=0;
1922;20.944.344;192.168.1.100;192.168.1.103;Modbus/TCP;66;   Query: Trans:   215;" Unit:   1, Func:   3: Read Holding Registers"""
1928;20.999.480;192.168.1.100;192.168.1.103;TCP;54;51003  >  502 [ACK] Seq=1921 Ack=2721 Win=64464 Len=0;
1933;21.054.119;192.168.1.100;192.168.1.103;Modbus/TCP;66;   Query: Trans:   216;" Unit:   1, Func:   3: Read Holding Registers"""
1938;21.122.024;192.168.1.100;192.168.1.103;TCP;54;51003  >  502 [ACK] Seq=1933 Ack=2738 Win=64447 Len=0;
1945;21.201.576;192.168.1.100;192.168.1.103;Modbus/TCP;66;   Query: Trans:   217;" Unit:   1, Func:   3: Read Holding Registers"""
1950;21.249.005;192.168.1.100;192.168.1.103;TCP;54;51003  >  502 [ACK] Seq=1945 Ack=2755 Win=64430 Len=0;
1957;21.308.684;192.168.1.100;192.168.1.103;Modbus/TCP;66;   Query: Trans:   218;" Unit:   1, Func:   3: Read Holding Registers"""
1962;21.375.660;192.168.1.100;192.168.1.103;TCP;54;51003  >  502 [ACK] Seq=1957 Ack=2772 Win=64413 Len=0;
1971;21.453.808;192.168.1.100;192.168.1.103;Modbus/TCP;66;   Query: Trans:   219;" Unit:   1, Func:   3: Read Holding Registers"""
1976;21.515.767;192.168.1.100;192.168.1.103;TCP;54;51003  >  502 [ACK] Seq=1969 Ack=2789 Win=64396 Len=0;
1982;21.588.892;192.168.1.100;192.168.1.103;Modbus/TCP;66;   Query: Trans:   220;" Unit:   1, Func:   3: Read Holding Registers"""
1986;21.641.764;192.168.1.100;192.168.1.103;TCP;54;51003  >  502 [ACK] Seq=1981 Ack=2806 Win=64379 Len=0;
1993;21.694.265;192.168.1.100;192.168.1.103;Modbus/TCP;66;   Query: Trans:   221;" Unit:   1, Func:   3: Read Holding Registers"""
1998;21.768.365;192.168.1.100;192.168.1.103;TCP;54;51003  >  502 [ACK] Seq=1993 Ack=2823 Win=64362 Len=0;
2005;21.841.016;192.168.1.100;192.168.1.103;Modbus/TCP;66;   Query: Trans:   222;" Unit:   1, Func:   3: Read Holding Registers"""
2010;21.894.321;192.168.1.100;192.168.1.103;TCP;54;51003  >  502 [ACK] Seq=2005 Ack=2840 Win=64345 Len=0;
2017;21.952.106;192.168.1.100;192.168.1.103;Modbus/TCP;66;   Query: Trans:   223;" Unit:   1, Func:   3: Read Holding Registers"""
2022;22.018.776;192.168.1.100;192.168.1.103;TCP;54;51003  >  502 [ACK] Seq=2017 Ack=2857 Win=64328 Len=0;
2029;22.094.480;192.168.1.100;192.168.1.103;Modbus/TCP;66;   Query: Trans:   224;" Unit:   1, Func:   3: Read Holding Registers"""
2034;22.144.879;192.168.1.100;192.168.1.103;TCP;54;51003  >  502 [ACK] Seq=2029 Ack=2874 Win=64311 Len=0;
